{
  "documentId": "doc_20260801_demo",
  "title": "Q3 产品方案",
  "creatorName": "Ming",
  "forwarderName": "Will",
  "permissionLabel": "可查看",
  "previewText": "这份文档整理了目标、范围、里程碑和待确认问题。",
  "updatedAt": "今天 10:30",
  "documentUrl": "https://example.com/docs/doc_20260801_demo",
  "linkUrl": "https://example.com/docs/doc_20260801_demo"
}
